{
  "schema_version": "1.0",
  "run_id": "11111111-1111-4111-8111-111111111111",
  "issues": [{"issue_id": "66666666-6666-4666-8666-666666666666", "title": "Synthetic issue", "severity": "low", "blocking": false, "status": "open", "requirement_ids": ["NFR-004"], "evidence_ids": [], "reproduction": ["Run the synthetic check."], "owner": null, "attempt_count": 0, "resolution": null, "regression_procedure": ["Rerun the synthetic check."], "created_at": "2026-08-16T08:10:00Z", "updated_at": "2026-08-16T08:10:00Z"}],
  "updated_at": "2026-08-16T08:10:00Z"
}
